{"schema_version":"1.0","decision_id":"decision-0037-03-01-authority","item_id":"0037-03.01","kind":"escalation","status":"approved","decided_at":"2026-08-16T09:47:00+02:00","authority":{"kind":"maintainer","identity":"maintainer@example.invalid","role":"lifecycle authority"},"question":"Which lifecycle state should represent a next action requiring explicit human approval?","options":[{"id":"blocked","summary":"Use blocked only for the next unresolved human action"},{"id":"in-progress","summary":"Keep the item in progress while awaiting human approval"}],"selected_option":"blocked","rationale":"A distinct blocked state prevents awaiting human authority from being confused with active autonomous work.","evidence":["docs/pipeline/issue-lifecycle.md#Legacy-marker-mapping"]}
